{
  "schemaVersion": 1,
  "id": "FA-CONF-LETTER-016",
  "status": "active",
  "version": "0.1.0",
  "profile": "fa-ir-g1",
  "profileVersion": "0.1.0",
  "ruleIds": [
    "FA-G1-LETTER-016"
  ],
  "input": {
    "text": "ش",
    "codePoints": [
      "U+0634"
    ]
  },
  "expected": {
    "cells": [
      "146"
    ],
    "unicodeBraille": "⠩",
    "structuralTokens": []
  },
  "tags": [
    "core-alphabet",
    "scalar"
  ],
  "notes": [
    "Materialized conformance vector for the fa-ir-g1 rule record.",
    "Activated because FA-G1-LETTER-016 is normative."
  ]
}
