{
  "schemaVersion": 1,
  "id": "FA-CONF-DIGIT-ASCII-004",
  "status": "draft",
  "version": "0.1.0",
  "profile": "fa-ir-g1",
  "profileVersion": "0.1.0",
  "ruleIds": [
    "FA-G1-DIGIT-ASCII-004"
  ],
  "input": {
    "text": "4",
    "codePoints": [
      "U+0034"
    ]
  },
  "expected": {
    "cells": [
      "145"
    ],
    "unicodeBraille": "⠙",
    "structuralTokens": []
  },
  "tags": [
    "phase-2.14",
    "adjudicated-candidate",
    "character",
    "digit"
  ],
  "notes": [
    "Draft conformance vector for adjudication FA-ADJ-DIGIT-ASCII-4-001.",
    "Activation requires a separate normative promotion."
  ]
}
