{
  "schemaVersion": 1,
  "id": "FA-CONF-LETTER-025",
  "status": "draft",
  "version": "0.1.0",
  "profile": "fa-ir-g1",
  "profileVersion": "0.1.0",
  "ruleIds": [
    "FA-G1-LETTER-025"
  ],
  "input": {
    "text": "ک",
    "codePoints": [
      "U+06A9"
    ]
  },
  "expected": {
    "cells": [
      "13"
    ],
    "unicodeBraille": "⠅",
    "structuralTokens": []
  },
  "tags": [
    "core-alphabet",
    "scalar"
  ],
  "notes": [
    "Phase 2.2 candidate conformance vector; not normative."
  ]
}
