{
  "schemaVersion": 1,
  "id": "FA-CONF-LATIN-018",
  "status": "draft",
  "version": "0.1.0",
  "profile": "fa-ir-g1",
  "profileVersion": "0.1.0",
  "ruleIds": [
    "FA-G1-LATIN-018"
  ],
  "input": {
    "text": "R",
    "codePoints": [
      "U+0052"
    ]
  },
  "expected": {
    "cells": [
      "1235"
    ],
    "unicodeBraille": "⠗",
    "structuralTokens": []
  },
  "tags": [
    "phase-2.14",
    "adjudicated-candidate",
    "character",
    "latin"
  ],
  "notes": [
    "Draft conformance vector for adjudication FA-ADJ-LATIN-018-001.",
    "Activation requires a separate normative promotion."
  ]
}
