{
  "schemaVersion": 1,
  "id": "FA-CONF-PUNC-ASTERISK-SINGLE-001",
  "status": "active",
  "version": "0.1.0",
  "profile": "fa-ir-g1",
  "profileVersion": "0.1.0",
  "ruleIds": [
    "FA-G1-PUNC-ASTERISK-SINGLE-001"
  ],
  "input": {
    "text": "*",
    "codePoints": [
      "U+002A"
    ]
  },
  "expected": {
    "cells": [
      "35",
      "35"
    ],
    "unicodeBraille": "⠔⠔",
    "structuralTokens": []
  },
  "tags": [
    "punctuation",
    "asterisk",
    "manual-backed"
  ],
  "notes": [
    "Materialized conformance vector for the fa-ir-g1 rule record.",
    "Activated because FA-G1-PUNC-ASTERISK-SINGLE-001 is normative."
  ]
}
