{
  "schemaVersion": 1,
  "id": "FA-CONF-LETTER-024",
  "status": "draft",
  "version": "0.1.0",
  "profile": "fa-ir-g1",
  "profileVersion": "0.1.0",
  "ruleIds": [
    "FA-G1-LETTER-024"
  ],
  "input": {
    "text": "ق",
    "codePoints": [
      "U+0642"
    ]
  },
  "expected": {
    "cells": [
      "12345"
    ],
    "unicodeBraille": "⠟",
    "structuralTokens": []
  },
  "tags": [
    "core-alphabet",
    "scalar"
  ],
  "notes": [
    "Materialized conformance vector for the fa-ir-g1 rule record."
  ]
}
