{
  "schemaVersion": 1,
  "id": "FA-CONF-DIGIT-PERSIAN-002",
  "status": "draft",
  "version": "0.1.0",
  "profile": "fa-ir-g1",
  "profileVersion": "0.1.0",
  "ruleIds": [
    "FA-G1-DIGIT-PERSIAN-002"
  ],
  "input": {
    "text": "۲",
    "codePoints": [
      "U+06F2"
    ]
  },
  "expected": {
    "cells": [
      "12"
    ],
    "unicodeBraille": "⠃",
    "structuralTokens": []
  },
  "tags": [
    "phase-2.14",
    "adjudicated-candidate",
    "character",
    "digit"
  ],
  "notes": [
    "Draft conformance vector for adjudication FA-ADJ-DIGIT-PERSIAN-2-001.",
    "Activation requires a separate normative promotion."
  ]
}
