{
  "schemaVersion": 1,
  "id": "FA-CONF-PUNC-SCALAR-004",
  "status": "draft",
  "version": "0.1.0",
  "profile": "fa-ir-g1",
  "profileVersion": "0.1.0",
  "ruleIds": [
    "FA-G1-PUNC-SCALAR-004"
  ],
  "input": {
    "text": ".",
    "codePoints": [
      "U+002E"
    ]
  },
  "expected": {
    "cells": [
      "256"
    ],
    "unicodeBraille": "⠲",
    "structuralTokens": []
  },
  "tags": [
    "phase-2.14",
    "adjudicated-candidate",
    "character",
    "punc"
  ],
  "notes": [
    "Draft conformance vector for adjudication FA-ADJ-PUNC-004-001.",
    "Activation requires a separate normative promotion."
  ]
}
