{
  "schemaVersion": 1,
  "id": "FA-CONF-LATIN-MODE-003",
  "status": "draft",
  "version": "0.1.0",
  "profile": "fa-ir-g1",
  "profileVersion": "0.1.0",
  "ruleIds": [
    "FA-G1-LATIN-MODE-003"
  ],
  "input": {
    "text": "",
    "codePoints": [],
    "tokenClass": "latin-span-end"
  },
  "expected": {
    "cells": [
      "25"
    ],
    "unicodeBraille": "⠒",
    "structuralTokens": []
  },
  "tags": [
    "phase-2.14",
    "adjudicated-candidate",
    "mode",
    "latin"
  ],
  "notes": [
    "Draft conformance vector for adjudication FA-ADJ-LATIN-MODE-003-001.",
    "Activation requires a separate normative promotion."
  ]
}
