{
  "schemaVersion": 1,
  "id": "FA-CONF-LAYOUT-021",
  "status": "draft",
  "version": "0.1.0",
  "profile": "fa-ir-g1",
  "profileVersion": "0.1.0",
  "ruleIds": [
    "FA-G1-LAYOUT-021"
  ],
  "input": {
    "text": " ",
    "codePoints": [
      "U+2029"
    ]
  },
  "expected": {
    "cells": [],
    "unicodeBraille": null,
    "structuralTokens": [
      "layout:paragraph-boundary-candidate:U+2029"
    ]
  },
  "tags": [
    "phase-2.14",
    "adjudicated-candidate",
    "layout",
    "ws"
  ],
  "notes": [
    "Draft conformance vector for adjudication FA-ADJ-WS-021-001.",
    "Activation requires a separate normative promotion."
  ]
}
